{"$schema":"https://json-schema.org/draft/2020-12/schema","$id":"https://schemas.socioprophet.org/agent-registry/orggov/actor-authority-binding.v0.1.schema.json","title":"OrgGov Actor Authority Binding v0.1","type":"object","additionalProperties":false,"required":["schemaVersion","recordType","recordId","workroomRef","workOrderRef","actors","roles","roleBindings","authorities","capabilityGrants","policyRefs","evidenceRefs","revocation"],"properties":{"schemaVersion":{"const":"orggov.actor-authority-binding.v0.1"},"recordType":{"const":"OrgGovActorAuthorityBinding"},"recordId":{"type":"string"},"workroomRef":{"type":"string"},"workOrderRef":{"type":"string"},"actors":{"type":"array","items":{"type":"object","additionalProperties":false,"required":["actorId","kind","displayName","registryRef"],"properties":{"actorId":{"type":"string"},"kind":{"type":"string","enum":["human","agent","service"]},"displayName":{"type":"string"},"registryRef":{"type":"string"},"status":{"type":"string"}}}},"roles":{"type":"array","items":{"type":"object","additionalProperties":false,"required":["roleId","title","authorityRefs"],"properties":{"roleId":{"type":"string"},"title":{"type":"string"},"authorityRefs":{"type":"array","items":{"type":"string"}}}}},"roleBindings":{"type":"array","items":{"type":"object","additionalProperties":false,"required":["bindingId","actorRef","roleRef","scopeRefs","capabilityGrantRefs","policyRefs","status"],"properties":{"bindingId":{"type":"string"},"actorRef":{"type":"string"},"roleRef":{"type":"string"},"scopeRefs":{"type":"array","items":{"type":"string"}},"capabilityGrantRefs":{"type":"array","items":{"type":"string"}},"policyRefs":{"type":"array","items":{"type":"string"}},"status":{"type":"string","enum":["active","suspended","revoked","expired"]}}}},"authorities":{"type":"array","items":{"type":"object","additionalProperties":false,"required":["authorityId","title","allowedActionRefs","assetScopeRefs"],"properties":{"authorityId":{"type":"string"},"title":{"type":"string"},"allowedActionRefs":{"type":"array","items":{"type":"string"}},"assetScopeRefs":{"type":"array","items":{"type":"string"}}}}},"capabilityGrants":{"type":"array","items":{"type":"object","additionalProperties":false,"required":["grantId","title","grantType","status","expiresAt"],"properties":{"grantId":{"type":"string"},"title":{"type":"string"},"grantType":{"type":"string","enum":["tool","data","model","action","review"]},"status":{"type":"string","enum":["active","suspended","revoked","expired"]},"expiresAt":{"type":"string"},"constraints":{"type":"array","items":{"type":"string"}}}}},"policyRefs":{"type":"array","items":{"type":"string"}},"evidenceRefs":{"type":"array","items":{"type":"string"}},"revocation":{"type":"object","additionalProperties":false,"required":["supported","revocationPolicyRef","revocationEvidenceRequired"],"properties":{"supported":{"type":"boolean"},"revocationPolicyRef":{"type":"string"},"revocationEvidenceRequired":{"type":"boolean"}}},"labels":{"type":"object","additionalProperties":{"type":"string"}}}}
