{"schemaVersion":"orggov.actor-authority-binding.v0.1","recordType":"OrgGovActorAuthorityBinding","recordId":"actor-authority-binding:orggov-v0","workroomRef":"workroom:orggov-v0","workOrderRef":"workorder:prophet-platform:406","actors":[{"actorId":"actor:mdheller","kind":"human","displayName":"Michael Heller","registryRef":"github-user://mdheller","status":"active"},{"actorId":"actor:orggov-planning-agent","kind":"agent","displayName":"OrgGov Planning Agent","registryRef":"agent-registry://orggov-planning-agent","status":"active"}],"roles":[{"roleId":"role:planning-and-contract-agent","title":"Planning and contract agent","authorityRefs":["authority:create-public-contract-fixtures"]},{"roleId":"role:human-reviewer","title":"Human evidence reviewer","authorityRefs":["authority:review-orggov-evidence"]}],"roleBindings":[{"bindingId":"rolebinding:agent:planner","actorRef":"actor:orggov-planning-agent","roleRef":"role:planning-and-contract-agent","scopeRefs":["workroom:orggov-v0","workorder:prophet-platform:406"],"capabilityGrantRefs":["grant:public-contract-fixtures"],"policyRefs":["policy://orggov/planning-agent"],"status":"active"},{"bindingId":"rolebinding:human:reviewer","actorRef":"actor:mdheller","roleRef":"role:human-reviewer","scopeRefs":["workroom:orggov-v0","workorder:prophet-platform:406"],"capabilityGrantRefs":["grant:review-orggov-evidence"],"policyRefs":["policy://orggov/human-reviewer"],"status":"active"}],"authorities":[{"authorityId":"authority:create-public-contract-fixtures","title":"Create public contract fixtures","allowedActionRefs":["action:create-contract-spine"],"assetScopeRefs":["asset:orggov-contracts"]},{"authorityId":"authority:review-orggov-evidence","title":"Review OrgGov evidence and outcomes","allowedActionRefs":["action:review-contract-spine"],"assetScopeRefs":["asset:orggov-contracts","evidence:parent-issue"]}],"capabilityGrants":[{"grantId":"grant:public-contract-fixtures","title":"Public contract fixture grant","grantType":"action","status":"active","expiresAt":"2026-06-05T00:00:00Z","constraints":["public fixtures only","no confidential material","review required"]},{"grantId":"grant:review-orggov-evidence","title":"Human evidence review grant","grantType":"review","status":"active","expiresAt":"2026-06-05T00:00:00Z","constraints":["review before merge","evidence required"]}],"policyRefs":["policy://orggov/planning-agent","policy://orggov/human-reviewer","github://SocioProphet/policy-fabric/issues/57"],"evidenceRefs":["github://SocioProphet/prophet-platform/issues/406","github://SocioProphet/prophet-platform/pull/409","github://SocioProphet/ontogenesis/pull/43","github://SocioProphet/prophet-workspace/issues/15"],"revocation":{"supported":true,"revocationPolicyRef":"policy://orggov/revoke-capability-grant","revocationEvidenceRequired":true},"labels":{"program":"orggov-v0","parent":"SocioProphet/prophet-platform#406","registryIssue":"SocioProphet/agent-registry#18"}}
